id,Category,Requirement Name,Description,User
REQ-001,ユーザー管理,顧客プロフィール登録,顧客が自身のニーズ（業種 地域 予算など）を含むプロフィールを登録できるようにする,顧客（地域住民）
REQ-002,ユーザー管理,事業者プロフィール登録,事業者が提供サービスの詳細を含むプロフィールを登録できるようにする,事業者
REQ-003,マッチング,自動マッチング処理,顧客のニーズと事業者の提供サービスを自動的に照合し 最適な組み合わせを提案する,システム
REQ-004,コミュニケーション,メッセージ機能,顧客と事業者がシステム内でメッセージをやり取りできるようにする,顧客 事業者
REQ-005,取引管理,決済処理,サービス提供後の決済をシステム内で安全に行えるようにする,顧客 事業者
REQ-006,評価管理,レビュー・評価機能,サービス利用後に顧客が事業者を評価し レビューを投稿できるようにする,顧客
REQ-007,ユーザー体験,お気に入り機能,顧客が気に入った事業者をお気に入りリストに追加できるようにする,顧客
REQ-008,マッチング,レコメンド機能,顧客の過去の利用履歴や好みに基づいて 適切な事業者を推薦する,システム
REQ-009,業務効率化,自動問い合わせ対応,顧客からの一般的な問い合わせに対して自動で回答する仕組みを構築する,システム
REQ-010,分析・改善,顧客満足度調査,定期的に顧客満足度調査を実施し その結果をシステム改善に活用する,顧客企業 システム管理者